snt_id	simplified_snt
G07.1_2111507945_2	The wide spread of misinformation over social media have bad consequences for public interest.
G07.1_2111507945_3	We design a framework to help identify misinformation.
G07.1_2111507945_4	The idea is to index the expertise of users and to match the experts with given suspected misinformation.
G07.1_2111507945_5	By sending the suspected misinformation to appropriate experts, they can judge the credibility of information, and help refute misinformation.
G07.1_2111507945_6	In this paper, we focus on finding appropriate experts for misinformation identification.
G07.1_2111507945_7	We propose a method to index the expertise of users with tags.
G07.1_2111507945_8	Experiments on a real world dataset demonstrate the effectiveness of our method for expert finding for misinformation identification.
G07.1_2124690797_1	The importance of research on misinformation has received wide recognition.
G07.1_2124690797_2	Two major challenges faced by this research community are the lack of theoretical models and the rare misinformation data.
G07.1_2124690797_3	This paper aims to address these challenges by conceptualizing misinformation and being able to completely understand and work on misinformation.
G07.1_2124690797_4	A representation and a model of misinformation are proposed through existing work in the field.
G07.1_2124690797_5	The model can guide future misinformation research and help building a digital misinformation library by advancing our knowledge on misinformation and by improving its sharing, management, and reuse.
G07.1_2124690797_6	In addition, we present a methodology for managing misinformation in a digital library, and suggest future research directions.
G07.2_2773680786_1	Conspiracy theories have gained much attention recently, due to their large impact on public events.
G07.2_2773680786_2	Little is known about how conspiracy theories are produced and developed on social media.
G07.2_2773680786_3	We present a study of conspiracy theory creation on Reddit during a public health crisis.
G07.2_2773680786_4	Using content and discourse analysis, we identified types of conspiracy theories that appeared on Reddit in response to the crisis, the conditions of their creation, and the strategies of their development in online forums.
G07.2_2773680786_5	Our analysis shows that conspiracy talk come from people trying to make sense of a public health crisis, which reflect their information needs and their lack of confidence in formal sources of information.
G07.2_2773680786_6	Implications for social computing researchers, health practitioners, and policymakers are discussed.
G07.2_2899514909_1	Conspiracy theories are omnipresent in online discussions.
G07.2_2899514909_2	Conspiracy theories evolve, multiply, and interconnect, complicating how to understand them and to limit their propagation.
G07.2_2899514909_3	It is crucial to develop methods to examine the nature of these conspiratorial discussions.
G07.2_2899514909_4	What do users talk about? What are the recurring elements in their discussions? What do these elements tell us about the way users think? This work answers these questions by analyzing over ten years of discussions in an online community on the social media Reddit dedicated to conspiratorial discussions.
G07.2_2899514909_5	We focus on the key elements of a conspiracy theory: the conspiratorial agents, the actions they perform, and their targets.
G07.2_2899514909_6	"For example, a narrative-motif (an idea) such as ""governmental agency-controls-communications"" represents the various ways in which multiple conspiratorial statements suggest how governmental agencies control information."
G07.2_2899514909_7	Narrative-motifs expose similarities between multiple conspiracy theories even when they refer to different events or circumstances.
G07.2_2899514909_8	These representations help us understand how users talk about conspiracy theories and offer us a means to interpret what they talk about.
G07.2_2899514909_9	Our approach enables a population-scale study of conspiracy theories in alternative news and social media and ways to understand them and limit their propagation.
G07.2_2749521565_1	To believe in conspiracy theories is understandable as conspiracies occur and if we take an evidential approach, belief in such theories turns out to be warranted in a range of cases.
G07.2_2749521565_2	Drawing on this work, I examine evidence associated with conspiracy theories, showing that the evidential problems are not unique to conspiracy theories.
G07.2_2749521565_3	The problem with the use of evidence of conspiracy theorist could be the principle which guides their use of it. I argue that there is no ground to be suspicious of conspiracy theories as a whole, because those are based on evidence.
G08.1_2907181942_1	Cryptocurrency is a financial technology innovation which has attracted many people around the world.
G08.1_2907181942_2	The high-speed evolution, radical price fluctuations of cryptocurrency, and the inconsistent attitudes of monetary authorities in different countries have caused panic.
G08.1_2907181942_3	In this paper, we analyze the dynamics and risks of the cryptocurrency market.
G08.1_2907181942_4	Consistent with public perception, our analysis reveals that the cryptocurrency market is fragile and unstable.
G08.1_2806518684_1	Blockchain technology is a technology developed for Bitcoin, the most common cryptocurrency.
G08.1_2806518684_2	Blockchain technologies have become popular with the potential to become a powerful disruptive force.
G08.1_2806518684_3	People and organizations may use it to increase secure data exchange and make transactions simpler and easier.
G08.1_2806518684_4	We investigate what influence people to use a blockchain cryptocurrency.
G08.1_2806518684_5	We develop a model of cryptocurrency adoption to identify how cryptocurrency is accepted.
G08.1_2806518684_6	Our evidence allow a better understanding of cryptocurrency adoption.
G08.1_2972302621_1	Cryptocurrency was initially an implementation of digital currency, then derivatives were created in various fields.
G08.1_2972302621_2	This paper aims to help understand cryptocurrency.
G08.1_2972302621_3	We compared cryptocurrency with foreign exchange and stock.
G08.1_2972302621_4	Our investigation suggests that cryptocurrency is similar to stock.
G08.1_2972302621_5	Our analysis shows that cryptocurrency market is more fragile than stock market, thus it is currently a high-risk financial market.
G08.1_3004077497_1	The owning rate of smart devices is higher than ever before and mobile payment has become a major payment method.
G08.1_3004077497_2	Cryptocurrency is becoming an important type of currency and the total value of cryptocurrencies has reached USD 200 billion.
G08.1_3004077497_3	Therefore, support of cryptocurrency payment on mobile devices is a natural demand.
G08.1_3004077497_4	Considering the poor infrastructure and the low usage of financial service in developing countries, this combination is especially attractive.
G08.1_3004077497_5	The high storage cost and payment processing latency are two obstacles for cryptocurrency mobile payment.
G08.1_3004077497_6	We propose two solutions, one with a centralized bank and the other one without any centralized party.
G08.1_3004077497_7	We also provide a solution for the bank to meet KYC (know your customer)/AML (antimoney laundering) expectations about cryptocurrency mobile payment.
G08.2_1607424157_1	Motivated by recent financial crises, research efforts have been put into studying contagion effects (spread of market disturbances) and herding behaviour (individuals acting collectively without centralized direction) in financial markets.
G08.2_1607424157_2	Much less has been said about influence of financial news on financial markets.
G08.2_1607424157_3	We propose a measure of collective behaviour in financial news on the Web, News Cohesiveness Index (NCI), and show that it can be used as a systemic risk indicator, which signals probability of financial system crises.
G08.2_1607424157_4	We evaluate the NCI on financial documents from Web news sources and analyse the relation between financial markets and financial news.
G08.2_1607424157_5	We hypothesized that strong cohesion in financial news reflects variations in the financial markets.
G08.2_1607424157_6	Cohesiveness is a better measure of systemic risk expressed in news, than measures based on simple occurrences of specific terms.
G08.2_1607424157_7	Our results show that cohesiveness in the financial news is highly correlated with variations in the financial markets.
G08.2_2807531787_1	In this paper, I propose a methodology to study the comovement (correlation on profits on investment) between the entropy (randomness and uncertainty) of different financial markets.
G08.2_2807531787_2	The entropy is based on the components measuring the stock market in financial markets from selected developed economies (France, Germany, the United Kingdom, and the United States).
G08.2_2807531787_3	I study how a shock in the entropy in the United States affects the entropy in the other financial markets.
G08.2_2807531787_4	I also model the entropy using different time variables and obtain a common factor behind the entropy movements in these four markets.
G09.1_2202800066_1	Mobile devices are very common in everyone’s day-to-day life.
G09.1_2202800066_2	Nowadays such devices come with many features of computers.
G09.1_2202800066_3	People can use these devices for diverse applications.
G09.1_2202800066_4	There are chances that these devices can be used for illegal activities.
G09.1_2202800066_5	The percentage of mobile phones or smart phones involved in cyber crimes is increasing.
G09.1_2202800066_6	So it becomes necessary to digitally analyze such devices with cyber forensics tools.
G09.1_2202800066_7	This paper discusses different types of digital evidence present in Microsoft’s Windows Mobile smart phones and how to acquire such devices.
G09.1_2202800066_8	Also it describes a forensic tool for acquiring and analyzing Windows Mobile devices and personal digital assistants.
G09.1_2921035272_1	Internet of Things (IoT) devices (devices connected to the internet, collecting and sharing data) will be used in digital forensic investigations in the future.
G09.1_2921035272_2	These devices have limited interfaces for communication, such as USB ports or WiFi/Bluetooth wireless interfaces.
G09.1_2921035272_3	Meanwhile, with an increasing focus on the security and privacy of user data, built-in encryption (which encode information) is becoming commonplace in devices.
G09.1_2921035272_4	This presents a significant challenge to digital forensic investigations, where data from IoT devices needs to be analysed.
G09.1_2921035272_5	This work explores the electromagnetic (EM) side-channel analysis literature for the purpose of assisting digital forensic investigations on IoT devices.
G09.1_2921035272_6	EM side-channel analysis is a technique where electromagnetic emissions are used for eavesdropping on the operations and data handling of devices.
G09.1_2921035272_7	The non-intrusive nature of EM side-channel approaches makes it a viable option to assist digital forensic investigations as these attacks require no modification to the target device.
G09.1_2921035272_8	The literature on various EM side-channel analysis attack techniques are discussed – selected according to their applicability in IoT device investigations.
G09.1_2921035272_9	The data obtained from our survey are used to identify promising future applications of the technique for digital forensic analysis on IoT devices.
G09.1_1965213295_1	The use of mobile phone forensics to investigate fraudulent activity is nothing new.
G09.1_1965213295_2	But mobile phones have evolved into smartphones, and fraudsters have evolved with them.
G09.1_1965213295_3	Smartphones have functionalities that can be used for data theft or inappropriate contact with other parties. They are out of the systems of the company and are not monitored or controlled.
G09.1_1965213295_4	Employers need to be aware of these risks when devices are delivered and have processes when suspicions are raised.
G09.1_1965213295_5	Detecting fraudsters with computer skills is a constant game of catch-up.
G09.1_1965213295_6	It's not only about playing catch-up with the cyberfraudster, but also the technologies that can be misused.
G09.1_1965213295_7	Moreover, the methods assisting fraudulent activities (still out of reach of company systems) are constantly evolving.
G09.1_1965213295_8	This means a company's intellectual property and sensitive data is at risk of sabotage or theft.
G09.1_2047319275_1	Phishers, people who attempt to trick people over the internet to steal their money, continue to modify the web pages used in their attacks to imitate websites of spoofed organizations and to avoid detection by phishing countermeasures.
G09.1_2047319275_2	Manipulations can be as subtle as changing the source code, which is the programming instructions, or as apparent as adding or removing significant content.
G09.1_2047319275_3	To respond to these changes to phishing campaigns, algorithms are used to detect phishing websites based on their content, employing a data set consisting of 17,992 phishing attacks targeting 159 different brands.
G09.1_2047319275_4	The results of the experiments using different approaches demonstrate that some can achieve a detection rate of greater than 90% while maintaining a low false positive rate.
M1_1_1	The period after exercise (1-8h) enhances the body's processes that reverse the effects of the exercise and promotes adaptation to the training.
M1_2_1	Nutritional strategies to optimize muscle recovery include proteins which are recommended to allow protein synthesis (production of new proteins which improve, for example, muscle mass) and carbohydrates to recharge glycogen stores (energy storage).
M1_3_1	Muscle contraction and consumption of leucine-rich protein (essential amino acid composing proteins) induce reactions which increase the protein synthesis.
M1_4_1	Consumption of 20-25 g of high quality protein after exercise and repeated every 4 h showed an optimal anabolic response (increasing muscle mass) of the muscles.
M1_6_1	Several studies showed that athletes are more likely to drink alcohol to excess (50-65% drink above dangerous level).
M1_7_1	Consequences of an excessive consumption after exercise are direct effect on the body but also indirect effect on the recovery due to an inappropriate eating and rest.
M1_8_1	Consumption of carbohydrates can partially counter balance the effects of alcohol on the recharge of glycogen stores but the effect on muscle protein synthesis are unknown.
M1_9_1	The aim of this study was to determine the effect of alcohol on anabolism and protein synthesis in humans during recovery following an effort an athlete could do (in rugby or football for example).
M1_10_1	We assumed that consumption of protein and alcohol (compared to protein only) would reduce protein synthesis.
M1_11_1	Eight healthy physically active men (3 trainings per week for at least 6 months) volunteered for this study.
M1_12_1	Subjects did high intensity exercise and just after consumed an alcohol-carbohydrate, an alcohol-protein or a protein drink in three separate occasions.
M1_13_1	Training consisted of eight sets of five repetitions of leg extension at 80% of their maximum strength.
M1_14_1	After 5 minutes rest, subjects cycled for 30 minutes at medium intensity,
M1_15_1	then 5 minutes at high intensity.
M1_16_1	Immediately following exercise and after 4 h recovery, subjects consumed a 500mL drink of protein or carbohydrates.
M1_17_1	A carbohydrate meal was consumed 2 h after exercise, according to recommendation for glycogen recovery.
M1_18_1	The 8 h period after exercise is an important phase for recovery but also the period during which blood alcohol level may be the highest after excessive consumption of alcohol.
M1_19_1	The alcohol consumption started 1 h after exercise with 6 drinks (60mL of vodka and 240mL of orange juice) and during 3 h.
M1_20_1	For the protein drink, orange juice was consumed with water instead of alcohol.
M1_21_1	Subjects consumed the drinks in 5 minutes every 30 minutes.
M1_22_1	Data (blood, protein synthesis, responses, etc.) were analyzed several times for the 3 different consumptions of drinks.
M1_23_1	The first finding of this study was that the mTOR enzyme (responsible for muscle growth) and protein synthesis (after exercise) were reduced by an excessive alcohol consumption during the 8 h period of recovery.
M1_24_1	Consequences were most evident when alcohol was consumed without protein (37 % reduction of protein synthesis).
M1_25_1	A second finding was that even with protein consumption, alcohol reduced protein synthesis by around 24%.
M1_26_1	mTOR is important in absorption of nutrients (like amino acids) and in sending signals to the body to produce an effort.
M1_27_1	The data from this study show that alcohol reduce the protein synthesis after exercise even with an optimal consumption of nutrients.
M1_28_1	The quantity of alcohol consumed in this study was based on consumption by athletes during binge drinking.
M1_29_1	However, reports show that some individuals can consume higher quantities, which is a concern for health and safety issues.
M1_30_1	Regrettably, it is difficult to find an educational message about alcohol consumption and sport performances that speaks to athletes.
M1_31_1	Considering the importance of protein synthesis (adaptation, repair and regeneration of muscles), the results of this study provide evidence of reduced recovery when alcohol is consumed after exercise, even with an optimal consumption of nutrients.
M1_32_1	We consider our data crucial for athletes and coaches.
M1_33_1	Our findings provide evidence for a message of moderation in alcohol consumption to promote recovery after exercise, with the potential to change sport cultures and athlete practices.
M10_42_1	In this paper we revisit a topic originally discussed in 1955, namely the lack of evidence that muscle growth plays an important role in increasing strength.
M10_42_2	To this day, long-term adaptations in strength are thought to be related to changes in muscle size.
M10_42_3	Given this assumption, training programs made for increasing both muscle size and strength were popular.
M10_42_4	However, the conclusion that a change in muscle size has an influence on strength is surprisingly based on little evidence.
M10_42_5	We suggest that these changes may be based on: (1) the weak correlation between the change in muscle size and the change in muscle strength after training; (2) the loss of muscle mass with the interruption of training, yet a maintenance of muscle strength; and (3) the similar muscle growth between low-load and high-load strength training, yet different results in strength.
M11_43_1	Low-intensity occlusion training, which is a training method with blood flow restriction, provides a unique beneficial training mode for muscle growth.
M11_43_2	Training at intensities as low as 20% of maximum strength with moderate occlusion results in muscle growth in 3 weeks.
M11_43_3	A typical exercise consists of 3 to 5 sets to muscle failure with short rest periods.
M11_43_4	The metabolic accumulation causes positive physiologic reactions, specifically a rise in growth hormone, which is one of the main hormone responsible of muscle growth, that is higher than levels found with higher intensities.
M11_43_5	Occlusion training is applicable for those who are unable to sustain high loads due to joint pain, postoperative patients, cardiac rehabilitation, athletes who are unloading, and astronauts.
M12_44_1	Current belief suggests cardio exercise training has minimal effect on muscle size.
M12_44_2	We and others have demonstrated that cardio exercise alters protein metabolism (responsible for protein synthesis and muscle growth) and induces muscle growth.
M12_44_3	These findings against the current belief provide a novel perspective on muscle mass regulation and insight into exercise to prevent muscle loss.
M13_45_1	Stretch training is used in a variety of fitness capacities such as increasing flexibility, preventing contractures (shortening of muscle) and reduce injuries.
M13_45_2	Moreover, some researches indicate that stretch training may induce muscle growth.
M13_45_3	The purpose of this review was to evaluate if stretch training is a viable strategy to induce muscle growth in humans.
M13_45_4	Of the 10 studies identified, 3 observed positive effects of stretch training on muscles.
M13_45_5	In these studies, the stretching was performed with external help like equipment or load.
M13_45_6	Of the 5 available studies that integrated stretching into strength training, 2 applied the stretching in the rest period between the sets and were the ones that showed enhanced muscle growth.
M13_45_7	In conclusion, passive, low-intensity stretch does not appear to produce beneficial changes in muscles but evidence suggests that when stretching is done with a certain intensity (particularly when loaded, or added between active muscle contractions), it may induce muscle growth.
M14_46_1	Cycling training is performed as a major part of any training program which objective is to improve cardiovascular capacities and health.
M14_46_2	However, the effect of cycling training on muscle size and strength still requires a better comprehension.
M14_46_3	Therefore, the purpose of this review is to discuss the effects of cycling training on muscle size and strength of the legs and the possible mechanisms for increasing muscle size with cycling training.
M14_46_4	It is plausible that cycling training requires a longer period to significantly increase muscle size compared to strength training due to a much slower muscle growth rate.
M14_46_5	Cycling training induces muscle growth similarly between young and older people, while strength gain seems to favor older adults.
M14_46_6	For young adults, series of high-intensity cycling may be required to achieve strength gains.
M14_46_7	It also appears that muscle growth induced by cycling training results from the positive changes in protein balance, which is the balance between protein intake which leads to muscle growth and protein loss which leads to muscle loss).
M15_47_1	Strength training is the most effective method to increase muscle mass.
M15_47_2	It has also been shown to promote many health benefits.
M15_47_3	Although it is helpful for treating and preventing diseases, a time-efficient and minimal dose of exercise has been the focus of a great number of research studies.
M15_47_4	Similarly, an inverted U-shaped relationship (which means that the efficiency increases until a point, and then starts decreasing) between training volume and physiological response has been hypothesized to exist.
M15_47_5	However, evidence supports a clear correlation between resistance training volume (number of exercises, sets, etc.) and physiological responses, such as muscle growth and health outcomes.
M15_47_6	Additionally, there is a lack of data to support the inverted U-shaped response.
M15_47_7	The principle suggested is that volume is the most easily modifiable variable that has the most important response, for muscle growth or health outcomes.
M16_48_1	The effects of short versus long rest intervals between sets in strength training on muscle growth have been investigated in several studies but the findings and the practical implications are unclear.
M16_48_2	Current evidence indicates that both short and long rest intervals may be useful for muscle growth.
M16_48_3	Novel findings suggest for trained people a possible advantage for the use of long rest intervals to induce muscle growth.
M16_48_4	However, due to the lack of studies with similar methodologies, further research is needed to provide a clear differentiation between these two approaches.
M17_49_1	Memory is a process in which information is encoded, stored, and retrieved.
M17_49_2	For vertebrates, it has been said that it occurs only in the brain.
M17_49_3	This review describes a cellular memory in muscles in which muscle growth is 'remembered' such that a fibre that has lost its mass, can regain it faster than untrained fibres.
M17_49_4	A new model, with the most reliable methods for identifying myonuclei (nuclei in muscle fiber), can explain this phenomenon.
M17_49_5	According to this model, previously untrained fibres recruit myonuclei from activated satellite cells (quiescent cells acting as a reserve population of cells for regeneration of muscle) before muscle growth.
M17_49_6	Even after grave muscle loss, the higher number of myonuclei is retained, and the myonuclei seem to be protected against programmed cell death observed during muscle loss.
M17_49_7	Fibres that have acquired a higher number of myonuclei grow faster during strength exercise, thus the nuclei represent a functionally important 'memory' of previous strength.
M17_49_8	This memory might be very long lasting in humans, as myonuclei are stable for at least 15 years and might even be permanent.
M17_49_9	However, myonuclei are harder to recruit for old people, and if the long-lasting muscle memory also exists in humans, one should consider early strength training as a public health advice.
M18_50_1	It has been hypothesized that eating small, frequent meals enhances fat loss and helps for better weight maintenance.
M18_50_2	Several studies support this hypothesis, with a link between the frequency of eating and being overweight.
M18_50_3	This review aims to present and discuss a research on meal frequency with respect to changes in body mass.
M18_50_4	Eating frequency was positively associated with reductions in fat mass and increasing in fat-free mass.
