snt_id	simplified_snt
M18_50_5	However, the positive findings were the product of a single study, leaving a doubt about the beneficial effect of frequent meals on body composition.
M18_50_6	In conclusion, although the initial results suggest a potential benefit of increased eating frequencies for enhancing body composition, these findings need to be carefully interpreted.
M19_51_1	Per decade, inactive adults experience a muscle loss of 3% to 8%, a reduction of resting metabolic rate (energy consumed by the body at rest) and fat accumulation.
M19_51_2	Ten weeks of strength training may increase fat-free mass by 1.4 kg, resting metabolic rate by 7%, and reduce fat weight by 1.8 kg.
M19_51_3	Benefits of strength training include improved physical performance, movement control, walking speed, functional independence, cognitive abilities, and self-esteem.
M19_51_4	Strength training may assist prevention and management of type 2 diabetes by decreasing abdominal fat, reducing HbA1c which is a form of hemoglobin linked to a sugar, increasing the density of glucose transporter type 4, and improving insulin sensitivity.
M19_51_5	Strength training may enhance cardiovascular health, by reducing resting blood pressure, decreasing 'bad' cholesterol and triglycerides (main constituents of body fat), and increasing 'good' cholesterol.
M19_51_6	Strength training may promote bone development, with studies showing 1% to 3% increase in bone mineral density.
M19_51_7	Strength training may be effective for reducing low back pain, joint and muscle pain, and reverse specific aging factors in muscles.
M2_34_1	Physical activity has many benefits like preventing diseases and improving general health.
M2_34_2	In popular opinion, it is recommended to start intense physical activities like weight lifting and plyometrics (exercises like sprint and jumps) after adolescence.
M2_34_3	But this advice does not seem to be based on facts.
M2_34_4	We did not find any recommendation against strength training at a young age if it is well supervised with safety rules, medical clearance, proper instruction from a professional and progressive overload (gradual increase of stress on muscle and nervous system).
M2_34_5	Several studies showed many benefits of repeated, intense physical efforts in young people.
M2_34_6	Improved motor skills and body composition (muscle mass increased, fat mass decreased, healthier bone) were found in studies, especially if sport practice began during puberty.
M2_34_7	We can conclude that strength training is a safe and healthy practice for children and adolescents.
M20_52_1	Human aging results in a variety of changes to muscles.
M20_52_2	Sarcopenia is the age-associated muscle loss and is one of the main contributors to muscle disorders in older adults.
M20_52_3	Previous research has demonstrated that strength training can attenuate muscle function deficits in older adults, however few articles have focused on the effects of strength training on mobility.
M20_52_4	The purpose of this review was to present the effects of strength training on mobility for older adults with muscle function deficits and to provide guidelines that can be used with seniors during strength training.
M20_52_5	We present evidence that strength training can attenuate age-related changes in mobility, including improvements in walking speed, static and dynamic balance, and fall risk reduction.
M20_52_6	Older adults should be encouraged to participate in strength training activities, and should avoid immobility.
M21_53_1	Maximizing the muscle growth following strength training can be done by manipulating variables like exercise selection, exercise order, rest intervals, intensity of maximal load, and training volume (number of exercises, sets, etc.).
M21_53_2	A neglected variable that also may impact muscle growth is repetition duration.
M21_53_3	Total duration of a repetition is the sum of the contraction, the lengthening and isometric (static contraction) and is based on the tempo.
M21_53_4	We conducted a review and analysis of multiple studies to determine if modification of repetition duration can amplify the muscle growth.
M21_53_5	Results indicate that muscle growth is similar when training with repetition durations from 0.5 to 8 s.
M21_53_6	Using a wide range of repetition durations can be employed if the primary goal is to maximize muscle growth.
M21_53_7	Findings suggest that training at very slow durations (>10s per repetition) is less efficient for muscle growth, although a lack of studies on the topic makes it difficult to draw definitive conclusions.
M22_54_1	Recovery from exercise refers to the time period between the end of exercise and the return to a resting or recovered state.
M22_54_2	It also refers to specific physiological processes occurring after exercise.
M22_54_3	Recovery of the cardiovascular system occurs across a period of minutes to hours, during which many characteristics of the system change over time.
M22_54_4	Some of these changes may be necessary for long-term adaptation to exercise training, yet some can lead to cardiovascular instability during recovery.
M22_54_5	These changes may provide insight into when the cardiovascular system has recovered and is physiologically ready for additional training.
M22_54_6	This review focuses on the most consistently observed blood flow adjustments and the causes that drive cardiovascular recovery and how they differ following strength and cardio exercise.
M22_54_7	First we focus on the effect leading to low blood pressure of cardio and strength exercise and associated mechanisms, which can progress to symptomatic hypotension (low blood pressure) and fainting.
M22_54_8	Finally, we focus on the practical application to maximize the benefits of cardiovascular recovery, or minimize the vulnerabilities.
M22_54_9	We will explore measures, and discuss how these can guide an athlete's training.
M23_55_1	Exercise and physical activity are key tools in the treatment and prevention of several medical conditions including joint disorders and diabetes.
M23_55_2	Exercise can reduce cardiovascular risk, inflammation, illness causing muscle loss, and hypertension, in addition to increasing physical functioning, strength, and cardio-respiratory capacity.
M23_55_3	Chronic kidney disease, a condition that affects around 10% of the population, is often neglected as a target for exercise-based therapy.
M23_55_4	Despite the vast range of severity in kidney disease, exercise has a potential role in all patients suffering from the condition.
M23_55_5	In this review, we summarise the potential important role of exercise in the management of kidney disease and how this form of 'medicine' should be used.
M24_56_1	Exercise with blood flow restriction (BFR) is used to increase strength in healthy individuals.
M24_56_2	However, its effects on individuals with knee pain are unknown.
M24_56_3	The objective is to determine the effectiveness of adding BFR to strength exercise for pain relief and improvement of function in patients with knee pain.
M24_56_4	We conducted a review and analysis of multiple studies.
M24_56_5	Studies that compared strength exercise with or without BFR to treat knee pain and function.
M24_56_6	The results showed that resistance exercises with BFR was not more effective than strength exercises for reducing pain and improving knee function in patients with knee pain.
M25_57_1	In Japan, 43 million patients had high blood pressure in 2010.
M25_57_2	The management of this condition and the importance of lifestyle changes for the prevention and treatment of high blood pressure has been recognized in Japan.
M25_57_3	In particular, increasing the levels of activities of daily living and physical exercise.
M25_57_4	In this review, we examined appropriate exercise prescriptions (e.g., type, intensity, duration per session, and frequency) for the prevention and treatment of high blood pressure.
M25_57_5	This review recommends full body cardio exercise at moderate intensity (i.e., 50-65% of maximum intensity, 30-60 min per session, 3-4 times a week) that focuses on the major muscle groups.
M25_57_6	Strength exercise should be performed at low-intensity without breath-holding and should be used as supplementary exercise, but it is contraindicated in patients with high blood pressure who have chest symptoms such as chest pain.
M3_35_1	Nowadays, people are interested in intermittent fasting (an eating pattern where you cycle between periods of eating and fasting)
M3_35_2	Nutrition is important for the optimization of sport performance so there is a concern about the effects of intermittent fasting on performance.
M3_35_3	Studies showed that there are no benefit in high-intensity, endurance or strength training while fasting.
M4_36_1	Physically active people encounter periods with limited time available for exercise.
M4_36_2	During such periods, the goal of training may be to simply maintain physical performance.
M4_36_3	Some people may also desire to maintain performance for prolonged periods, like athletes during competitive season or militaries during deployment.
M4_36_4	Endurance performance can be maintained for up to 15 weeks with 2 trainings per week, or with a reduction of 13–26 minutes per training, as long as exercise intensity (exercising heart rate) is maintained.
M4_36_5	Strength and muscle size can be maintained for up to 32 weeks with 1 strength training per week and 1 set per exercise, as long as exercise intensity (load) is maintained. In older populations, maintaining muscle size may require up to 2 trainings per week and 2–3 sets per exercise, while maintaining exercise intensity.
M4_36_6	Exercise intensity seems to be the key variable for maintaining physical performance, even with reduction of frequency and volume (number of exercises, sets, etc.)
M5_37_1	Nutrient timing is a popular nutritional strategy that involves the consumption of combinations of nutrients around an exercise session.
M5_37_2	Some people say that this approach can produce dramatic improvements in body composition.
M5_37_3	It has even been hypothesized that the timing may be more important than the total daily intake of nutrients.
M5_37_4	The post-exercise period is considered the most important part of nutrient timing.
M5_37_5	In theory, consuming the proper ratio of nutrients during this time allows the rebuilding of damaged muscle tissue and restoration of energy reserves, but also enhances both body composition and exercise performance.
M5_37_6	Researchers have made reference to an anabolic “window of opportunity” (a limited time after training to optimize muscular adaptations).
M5_37_7	However, the importance - and even the existence - of a post-exercise ‘window’ can vary according to a number of factors.
M5_37_8	Research is uncertain about the applicability of nutrient timing. Besides, the relevance of post-exercise nutritional intake concerning anabolism (increasing muscle mass) has been challenged by recent evidence.
M6_38_1	Lack of time is one of the most common reason for not exercising.
M6_38_2	The aim of this review was to determine how strength training can be time-efficient by evaluating research on training variables, advanced training techniques, and the need for warm-up and stretching.
M6_38_3	We recommend choosing bilateral (with the two arms or legs), multi-joint (multiple joints involved) exercises that include full dynamic movements and to perform a minimum of one leg pressing exercise (e.g. squats), one pulling exercise (e.g. pull-up) and one pushing exercise (e.g. bench press).
M6_38_4	Exercises can be performed with machines and/or free weights.
M6_38_5	Weekly training volume (number of exercises, sets, etc.) is more important than training frequency and we recommend a minimum of 4 weekly sets per muscle group using a load that permits to do 6 to 15 repetitions.
M6_38_6	Advanced training techniques like combining exercises with no rest or shortening the rest time while using lighter weights can cuts the training time in half, while maintaining training volume.
M6_38_7	However, these methods are probably better to increase muscle mass than strength.
M6_38_8	Finally, we advise exercise-specific warm-ups, and stretching only if the goal of training is to increase flexibility.
M7_39_1	Training frequency is an important variable for hypertrophy (increasing muscle mass) in strength training.
M7_39_2	The purpose of this paper was to conduct a review and analysis of multiple studies investigating the effects of weekly training frequency on hypertrophy.
M7_39_3	Results showed no significant difference between higher and lower frequency with the same training volume (number of exercises, sets, etc.).
M7_39_4	Analysis of studies with different training volumes showed better results for higher frequencies, although the difference between frequencies of 1 and 3+ days per week was small.
M7_39_5	In conclusion, there is strong evidence that resistance training frequency does not significantly impact muscle hypertrophy when training volume is the same.
M7_39_6	Thus, for a given training volume, individuals can choose a weekly frequency per muscle groups based on personal preference.
M8_40_1	A variety of training techniques have been suggested to support muscle growth.
M8_40_2	Forced repetitions/drop sets (use lighter weight or receiving help to continue the set), supersets (combining exercises with no rest), and heavy negatives (lowering phase of the lift), are pretended to enhance hypertrophy (increasing muscle mass).
M8_40_3	This article will explore the potential role of these techniques in promoting muscle hypertrophy and provide an insight into possible applications to strength training.
M9_41_1	Increasing muscle mass is the goal of many people who lift weights.
M9_41_2	Research is lacking, however, as to the optimal way to induce muscle growth.
M9_41_3	Bodybuilders train with moderate loads and short rest intervals.
M9_41_4	Powerlifters, on the other hand, train with high-intensity loads and lengthy rest periods.
M9_41_5	Although both groups are known to display impressive muscularity, it is not clear which method is superior for increasing muscle mass.
M9_41_6	It has been shown that many factors mediate the process of muscle growth and that mechanical tension, muscle damage, and metabolic stress all can play a role in muscle growth.
M9_41_7	Therefore, the purpose of this paper is to review the literature as to the mechanisms of muscle hypertrophy and their application to exercise training and to draw conclusions from the research as to the optimal way to induce muscle growth.
